index,segment,answerDate,NPS,impactInteraction,reason,improvement
0,Segmento 1,MES 1,0,3,Porque el banco no respalda a sus clientes y tiene un mal servicio muy deficiente en seguridad no responden a la seguridad de los usuarios es pésimo,Es un banco ineficiente
1,Segmento 1,MES 2,5,2,No sé soluciono el problema,Más oficinas
2,Segmento 1,MES 3,5,3,Mucha demora para ll atiendan para consultas,Más módulos de atencion
3,Segmento 1,MES 1,6,3,"La atención estubo bien ,la molestia es por qué los intereses son muy altos había hecho un referido para modular la cuota y cobraron más intereses pero la cuota no bajo antes subió más y pedí explicación y no me la dieron solo me digeron eso lo arrojaba el sistema ,la verdad muy desepsionado ,años atrás tu e un inconveniente con una consignación que hice en el Yumbo hice los respectivos procesos y nunca me devolvieron ese dinero me tocó pagar nuevamente",Que las tarifas sean reales a como se las explican a uno dicen una cosa y cobran otra
4,Segmento 1,MES 2,5,3,ninguna,gracias
5,Segmento 2,MES 3,1,1,Porque ustedes toman desicion es por el cliente sin tener en cuenta que nosotros somos los que colocamos la plata Par que ustedes la trabajen.... Y acaban con la confianza que detenía en ustedes.. Muy grave.,En. Nada ya no me interesa si no terminar de pagarles la deuda porque ustedes ya me retiraron del banco.
6,Segmento 1,MES 1,5,5,"Llega uno a pagar la tarjeta al área de cajas porque no lo hago por otro canal. porque es complicado y no pago lo que estipula el extracto que me envían sino que pago mas para liberar el monto y me dicen que no lo puedo hacer, tengo otras tarjetas con otras entidades y esto no me sucede y esto para mi es incomodo todos los meses pasar por esta situación.","Perdón, no soy yo la persona indicada para decirles que deben mejorar"
7,Segmento 1,MES 2,4,1,"Porque no hay oficinas suficientes para los pagos, había una oficina en Centro empresarial Conecta y lo quitaron ,los intereses muy altos en los prestamos",Crear mas oficinas para facilitar los pagos
8,Segmento 1,MES 3,5,3,"Nada especial, es igual a las demas","mejores sillas, las que hay no tienen espaldar y hay que esperar mcho y es incomodo."
9,Segmento 1,MES 1,0,1,No me colaboraron ni me facilitaron solucion a la dificultad que tengo con el banco.,"Por favor un asesor me atienda personalizado 
Tengo dificultad para ingresar a mi app de Colpatria no obtengo código de contraseña 
Me lo envían por mensaje al teléfono que se canceló.
Deseo que por favor me envíen la información al correo 
No puedo asistir a una oficina pues no estoy en el país 
Por favor urge su colaboración 
Gracias
Mi dificultad es que"
10,Segmento 2,MES 2,0,1,No resuelven los problemas que el mismo Banco genera,Entregar una tarjeta que el Banco bloqueo por decisión propia
11,Segmento 2,MES 3,0,3,No dan soluciones,"Den soluciones .
Escuchar al cliente y darle opciones de lo q el cliente quiere"
12,Segmento 1,MES 1,3,2,"Porque me hicieron cargos a mi tarjeta de crédito sobre adquisiciones que yo no hice y el banco no colaboró en investigar de donde provenian los cargos, ya que no era nombre conocido.",Ser responsables y preocuparse no sólo por sus productos sino por el usuario o consumidor de los mismos que es la esencia del negocio.
13,Segmento 2,MES 2,4,3,Al cliente preferencial no lo tienen en cuente de pasarlo pronto,Decirle a sus empleados que tienen que estar más pendientes de la atención prioritaria
14,Segmento 1,MES 3,0,1,Mala atención a el cliente,
15,Segmento 2,MES 1,6,3,porque cada vez hay menos oficinas en el sector,dejar de eliminar oficinas en la ciudad
16,Segmento 1,MES 2,4,1,No hubo una atención acertiva,Preparar más a su personal en servicio al cliente
17,Segmento 1,MES 3,0,1,"Mal servicio ,no hay linea cada vez que voy al banco ,calor",
18,Segmento 1,MES 1,0,1,Mucha demora oficina también si uno llama que Servio tan malo,Mejores asesores
19,Segmento 2,MES 2,6,2,NO tenemos quien nos atienda.,"volver a tener una persona que  lo atienda, seguramente hicieron recorte de personal y no tiene tiempo."
20,Segmento 1,MES 3,0,1,"El cierre de oficinas perjudica a los clientes, y más cuando se hace de manera premeditada y no se informa",Por lo menos poner más personal que atienda en caja en las oficinas que quedan. Si van a cerrar todas las oficinas bancarias INFORMEN!
21,Segmento 1,MES 1,2,1,El tiempo de espera es largo y no me ayudaron con mi requerimiento,Tener más asesores para atención al cliente y mejorar la información que manejan ya que muchas veces no es la misma que manejan todos
22,Segmento 1,MES 2,0,1,Servicio pésimo,No hay solución
23,Segmento 1,MES 3,5,1,"Aprovecho la oportunidad para comentar en la asistencia medica en el exterior  al definir los pagos hospitalarios fue muy difícil la comunicación con ustedes,  y los correos que envié nunca tuvieron una respuesta, gracias.","Que en todas las áreas, tengamos acceso telefónicamente, como por ejemplo en tesorería porque realicé muchas llamadas y lo que me informaron es que para ese área solo enviar los correos."
24,Segmento 1,MES 1,0,1,Mora en atención y respuestas tardías sin solución en cuanto a seguros que por intermedio de la entidad los usuarios adquieren.,Dar respuesta clara y efectiva y hacer control a la aseguradoras que por intermedio de la entidad ofrecen sus servicios en mi caso el seguro de mascotas. Adicionalmente revisar las cuotas de interés tan elevadas que tiene la entidad. Pues aseguran que en un pago de una cuota no genera interés siendo esto una falacia.
25,Segmento 1,MES 2,4,2,Cuota de manejo de la tarjeta muy costosa,No cobrar la cuota de manejo
26,Segmento 1,MES 3,5,3,"ES EL BANCO QUE LE SACA AL CLIENTE EL DINERO DE LOS BOLSILLOS. COBRAN CUOTA MANEJO, SEGURO, INTERESES CORRIENTES, INTERESES MORA Y COMO LES PARECE POCO: COBRANZAS POR HACER UNA LLAMADA.",ANALICEN COMO AYUDAR AL CLIENTE. SI ES DIFERENTE MAS LLEGAN. CON LOS COSTOS AHUYENTAN.
27,Segmento 1,MES 1,5,3,"Los CDT no tiene más días para cancelar, si no que tiene que ser el mismo día. Terrible.",Ser más más asequible al cliente
28,Segmento 1,MES 2,6,4,Tenía otras expectativas,Quitar la cuota de manejo de la tarjeta que voy a recibir
29,Segmento 1,MES 3,2,2,"La informaciónes obtenida fue confusa
Quedé insatisfecho
No me llamen al teléfono
Cuando vaya a sus oficinas
Me explican
Por favor.",
30,Segmento 2,MES 1,2,3,No sé pudo solucionar  nada,Solucinar
31,Segmento 1,MES 2,5,3,"demora en el servicio e información acerca de pagos incompleta, se les pregunta a los asesores y tampoco saben",mejorar la información suministrada
32,Segmento 1,MES 3,1,1,"Ustedes, son abusivos, le cambian la condiciones del contrato al cliente, eso tipifica abuso de poder y constituye actuación reprochable a al tenor de Código de Comercio y las disipaciones de la superintendencia Bancaria","Ser respetuosos de la legislación que gobierna el servicio bancario y no abrogarse poderes exorbitantes que ninguna norma le ha otorgado...Abusivos mediocres...el Banco no es de Ustedes, ubíquense en la posición que les corresponde lambones, serviles.."
33,Segmento 2,MES 1,1,1,"Mucho tiempo para solicitar certificado hipotecario (20) dias. Nunca llego al correo
Luego ir a hacer dos horas de fila para que le digan que hubo una falla el correo llego pero no se puede bajar el documento",Mejorar el servicio
34,Segmento 1,MES 2,0,2,Veinte minutos esperando con el banco sin filas y no se habían dado cuenta de que había turnos de asesoría.,"Mejorar la usabilidad de la banca virtual, no se ve fácilmente el número de cuotas de las compras con TC. Hacer llegar las comunicaciones de respuesta a casos abiertos, redactarlas con profesionalismo. No cambiar las condiciones de número de transacciones para no pagar cuota de manejo."
35,Segmento 1,MES 3,5,1,"Había poca afluencia de clientes y los cajeros estaban hablando entre sí, solo 1 de 3 estaba atendiendo al público.","Si tienen cajeros haciendo otro tipo de actividades (social/pausas activas  u operativas)y no pueden atender a los clientes de la oficina deberían no ser visibles para el público que espera, esto fomenta la molestia en los clientes que esperan"
36,Segmento 1,MES 1,6,5,"Buena atención, y cordialidad de parte de la asesora","Todo está muy bien, no creo que deban mejorar"
37,Segmento 1,MES 2,1,2,"Porque estoy pensando retirarme, porque la única oficina qué tenemos en el barrio 20 de julio la suspenden a partir del 1 de noviembre, y ya nos quedaríamos sin colpatria en el barrio",En vez de retirar esa oficina deveran colocar otra en el barrio
38,Segmento 1,MES 3,0,1,No hay soluciones en la.oficina no tienen capacidad de resolver nos ponen a marcar a una linea de telefono toca entregar la tarjeta de credito por un cupo de 600000 estoy pagando un manejo del 5 por ciento mensual es un verdadero abuso,A mi nada por q no quiero ser mas cliente de uds gracias
39,Segmento 2,MES 1,6,3,Normalmente no me siento satisfecha con el banco,"La atención fue buena, no son las personas quienes me incomodan"
40,Segmento 1,MES 2,0,3,Nunca funciona la plataforma para la realización de pagos,Invertir recursos en la mejora de la plataforma para hacer todo de manera virtual
41,Segmento 1,MES 3,0,1,no hay solución rápida,soluciones radicales y las líneas de atención siempre estén en funcionamiento
42,Segmento 1,MES 1,5,4,Los intereses son muy altos,Hise una reclamación y no e octenido respuesta
43,Segmento 1,MES 2,0,1,No tuve solución  ami solicitud,Analizar  bien el perfil  de los clientes
44,Segmento 2,MES 3,1,2,"Demora en la atención, solo fui a hacer un abono a mis créditos y me tomo una hora hacerlo",Yo preferiria poder hacer mis diligencias de forma virtual
45,Segmento 1,MES 1,3,3,No  uvo. Solocion de nada,Que aya preferencia para los discapacitados
46,Segmento 2,MES 2,3,3,Hago abonos a capital para bajar el valor de la cuota y no bajan la cuota hasta que llamo a hacer el reclamo.,
47,Segmento 1,MES 3,1,2,"Creo que la máquina que cuenta los billetes en caja 3 presenta falla. Antes de ir hacer el pago en la sucursal, conté muy bien la plata en mi casa, llevaba 6 millones en billetes de 100 mil pesos para hacer el pago de la tarjeta crédito, no estoy completamente seguro, pero puede que les sobraron 100 mil pesos al finalizar el turno.","Verificar la novedad, no es una afirmación pero si tengo esa duda al momento del pago."
48,Segmento 1,MES 1,4,5,Es un banco muy bueno yo es porque ya tengo mis años no quiero endeudarme mas,Ya an echo mucho por mi
49,Segmento 1,MES 2,0,1,Porque no resolvieron la inquietud que tengo,"Si uno tiene un crédito con ustedes ,son ustedes los que le deben dar solución a sus inquietudes."
50,Segmento 1,MES 3,0,4,La atención fue buena,
51,Segmento 1,MES 1,2,1,Porque me dieron un valor a pagar que no era y después me llaman del banco y me dicen que tengo días de mora por la mala información que me dieron en el banco al momento de pagar,"Tener una mejor información de lo que debe uno pagar en todas la plataformas (app, banco, línea telefónica etc)"
52,Segmento 2,MES 2,5,2,No me resolvieron el motivo de mi visita  ala oficina. me dirigen a la multilinea y es imposible la comunicacion,Más facilidad y agilidad ala hora de realizar algún tramite sea oficina o virtual
53,Segmento 1,MES 3,2,2,porque me quitaron mis extractos fisicos impresos.  Me han hecho perder mucho tiempo. No me responden radicados,"no engañarme con los extractos.  Este año ha sido pesimo con ese tema, me engañan diciendome que si me van a llegar,  6 o mas meses atras llegaba uno y no el otro, o lo contrario hasta que hace 6 meses ya no llega ninguno. Voy a Cancelar todos los seguros que tome a traves de ustedes y posiblemente mis 2 tarjetas tambien"
54,Segmento 1,MES 1,3,1,"Aseguran que compré un seguro de fraude, que yo no compré. Me mostraron el mensaje ofreciendomelo,  pero no mi respuesta. Así que me lo adjudicaron sin mi aceptación.","Anular la compra del seguro, que no acepté."
55,Segmento 1,MES 2,5,4,"Me habia retirado...retome nuevamente la TC con ustedes y el cupo de hoy ganando mas no es ni la mitad de lo que tenia...voy a darme un tiempo a ver si lo aumentan, o cancelo",Cupo y cuota de manejo
56,Segmento 1,MES 3,3,2,PORQUE NO ME SOLUCIONARON LO QUE PRETENDIA Y EN OTRA ENTIDAD FUE COMO EN JET,YA NO LA PRIMERA IMPRESION DEJA MUCHO QUE DESEAR
57,Segmento 1,MES 1,0,1,La comunicación con el banco es super mala,Mejorar la atención al cliente
58,Segmento 1,MES 2,0,1,Mucha espera muy mal servicio,Ser más ágiles y eficientes
59,Segmento 1,MES 3,2,3,"Porque igual uno se aguanta las. Filas y la atención del asesor del crédito pésimo
Muy mala asesoría
No dice las cosas y se lleva uno sorpresas 😏",Aumentar asesores y personas q sean transparentes
60,Segmento 1,MES 1,0,1,"Primero pantalla de turnos mala; los dichos en mesa del lado pero no hay un aviso de la ubicación de estos.
Me dejaron 20
Minutos esperando",Mejor información
61,Segmento 1,MES 2,6,5,"Exelente atención por parte de las asesoras, rápida atención y amabilidad",Me parece bien su atención
62,Segmento 1,MES 3,3,2,Más atención al cliente,Tener más redes de cajeros para el retiro del dinero o redes aval
63,Segmento 1,MES 1,5,3,Hay mucha gente en asesoria,Mejorar la atencion
64,Segmento 1,MES 2,5,3,El proceso de atención es demasiado lento.,"Si el flujo de clientes en la sede es tan constante, se recomendaria que al menos 2 o 3 asesores esten disponibles para la atención de los usuarios. En mi caso solo estaba disponible un asesor y tuve que esperar 1 hora para ser atendida"
65,Segmento 1,MES 3,2,4,"A sido imposible comunicarme con un asesor,  tengo el inconveniente de que no volvió a llegar el extracto y quiero saber como puedo cancelar mi tarjeta terminada en 9408","Que sea fácil resolver inquietudes en cualquier oficina,  la respuesta de los asesores de estas oficina es que todo por la. Aplicación; y no soy la más experta"
66,Segmento 1,MES 1,3,3,Solo fuy apagar la tarjeta de credito y no porq siempre es difícil hablar con los asesores y el banco pone mucho problema para un crédito,Mejorar y no exigir de maxiado para los créditos
67,Segmento 1,MES 2,0,1,"Por favor revisen esta cuenta porque yo soy de Argentina y están usando mi correo electrónico para llenarme de Spam 😡 nose como puedo solucionar este problema, en ningún momento me hice una cuenta en esto que nose que sea pero siempre me llegan mails de extracciones y movimientos en mi ""supuesta cuenta"".... nose donde puedo reclamar o denunciar este asunto, por favor revisen esto porque me quiero desuscribir y no me lo permiten..dejen de enviarme mails y eliminen mi cuenta de correo electrónico.","Dejen de enviarme spam a mi correo electrónico, soy de Argentina y en ningún momento me suscribí a nada, están usando mi nombre y mi correo para nose que sea...."
68,Segmento 1,MES 3,2,1,me demore una y media para que me atendieran,mejorar el tiempo de respuesta
69,Segmento 1,MES 1,5,2,Porque no me  llegan mis estractos y no sé cuánto debo pagar,Por favor seguir enviando los estractos a mi correo personal como d costumbre
70,Segmento 2,MES 2,0,3,"Pésimo banco, las respuestas dadas por sus funcionarios no resuelven las inconformidades de los clientes.",
71,Segmento 1,MES 3,1,3,la atención fue muy regular.. me decian que le preguntara el jede de la sucursal.. por atender a otra persona amigo del señor q llego en ese momento,tener atencion telefonica que uno llama y no hay menu de atencion con asesor
72,Segmento 1,MES 1,0,3,No mde dieron solución ni repuesta ah lo que necesitaba,Que den una respuesta coherente ah mi servicio que nececito
73,Segmento 1,MES 2,4,2,"No existe la discreción: una señora fue a sacar plata y, de viva voz dijo que necesitaba $3 millones en efectivo y $ 9 en cheque. Todos los que estábamos allí, nos enteramos.Eso pone en riesgo a los usuarios. Son muy lentos y puede mejorar la experiencia del cliente o usuario","Mejor entrenamiento a los cajeros en atención al publico. 
Trabajo en equipo (mucho chisme entre ellos)
Talonarios o sistema donde una pueda registrar la operación y cuantía que necesitaba
Uniformes a los colaboradores"
74,Segmento 1,MES 3,0,3,Es un banco donde nadie da información concreta y clara y ponen muchas trabas para cerrar una cuenta.,
75,Segmento 2,MES 1,6,3,Es un banco muy costoso,
76,Segmento 1,MES 2,6,3,El servicio en ocasiones es bueno y otras poco,Tener más cajeros de acuerdo a la cantidad de gente q este llegando
77,Segmento 1,MES 3,4,4,El señor que  llama cesar atendía a la gente sin respetar el turno...,Que se respeten los turnos me parece que si uno saca un turno tiene que esperar su turno y el señor César atendió a otra persona sin turno y lo saludó
78,Segmento 1,MES 1,0,1,"La oficina muy desordenada, se estaba haciendo fila y un funcionario daño la fila, mucha demora para atender pocos empleados. No atendieron todos mis requerimientos.",Poner más empleados en las oficinas y capacitarlos para que puedan resolver las inquietudes.
79,Segmento 1,MES 2,5,3,Por la demora,Ser un poco más eficientes
80,Segmento 2,MES 3,0,1,Estoy retirándome de Colpatria. No me han respondido por dos pagos que suman $2.930.000,nada gracias
81,Segmento 1,MES 1,0,1,"Mala atención. No resolución del problema, esta frente al funcionario y tienes que hacer el trámite telefónico o virtual",Acompañamiento. Responder las solicitudes. Equipo que maneje integralmente las solicitudes
82,Segmento 1,MES 2,5,2,Mucha demora en la atención.,Más agilidad de los asesores
83,Segmento 2,MES 3,5,3,No saben lo que es servicio al cliente. Son personas prepotentes y el cliente no les interesa,"Capacitar la gente , que entiendan que el cliente es importante y bajen un poco esa prepotencia de creerse lo máximo y el cliente es un pobre aparecido"
84,Segmento 1,MES 1,0,1,,
85,Segmento 1,MES 2,3,3,"Me parece muy delicados que los abonos por pse no se reflejen el mismo día , he incluso que no se abonen a la tarjeta y que haya que esperar 20 días para solucionar","El sistema de pago es línea no es confiable, eso se debe mejorar"
86,Segmento 1,MES 3,5,1,Duré haciendo cola 40 minutos para llegar a caja y sólo éramos cuatro cliente había sólo una cajera atendiendo a los presentes nos pareció que era lenta sería importante que contarán con dos cajeros siempre y los tiempos con los acesores es muy largo,El siempre tengan dos cajeros y que sean ágiles si miran la grabación verán cuatro señoras muy molestas pq les parecía una falta de respeto con la tercera edad en este momento llegó una prácticamente y trato de calmar los ánimos
87,Segmento 2,MES 1,4,1,No se ha podido utilizar oportunamente la banca virtual para transferencias y se me han causado costos con la tardía reversión de las que se han dispuesto.,"Tener un sistema de banca virtual más agil, y oportuno."
88,Segmento 1,MES 2,6,3,Muchos inconvenientes,mejorar
89,Segmento 2,MES 3,5,3,Mucha demora para la atención a los clientes,Ser más activos atención prioritaria y ligera no demora la atención más de 10 minutos máximo con el cliente
90,Segmento 2,MES 1,3,3,No es coherente que uno envíe a una persona a que realice el pago y no lo reciban porque no es el titular,"Los cajeros expresan que desconocen cuál es el pago de la tarjeta de crédito y cuál el del préstamo, además creen que se trata de un embargo y se realiza por una cantidad inferior. Si resuelven esto, se avanza bastante"
91,Segmento 1,MES 2,0,1,Se paga mucho interés  corriente  muy poco. Al saldo. Vampiros,Bajar interés corriente
92,Segmento 1,MES 3,4,4,Buena atención,Más cajeros  automáticos
93,Segmento 2,MES 1,0,1,Mal.sercivio,Atender al cliente
94,Segmento 1,MES 2,1,3,"Una cuota de manejo mensual costosa, aunado a unos intereses demasiado altos.",Nada. Gracias.
95,Segmento 1,MES 3,2,1,No solucionan los problemas ellos no tienen la información actualizada y ml q hacen es perjudicar al usuario,Los.empleados en oficina no deberían ser solo.mauquinas q reciben dinero o papeles deben atender de manera integral y q realmente den soluciones
96,Segmento 1,MES 1,0,1,Me robaron,
97,Segmento 2,MES 2,0,3,No son idóneo para prestar asesoría,No creo que puedan dar un mejor servicio!
98,Segmento 1,MES 3,3,3,Service is extremely horrible.,"Obviously hire more cashiers or put the 7-8-9 people doing nothing to work as cashiers.Teach them to do more than just sitting there. Cross training. Aproximately year ago I withdrew $26,000,000 mil pesos after going to Scotia three times to make a deposit. Waiting a grand total of one hour and 18 minutes for the three tries at depositing, I withdrew my money and walked out. You truely have no service. The trip on  Dec. 12th a little better as only 12 people were in line waiting on the one cashier while your other 9-10 employees basicily sat doing nothing. Pretty much the same every time I try and make a deposit."
99,Segmento 1,MES 1,0,1,"El aseosr que me qtendio me hizo entender que no es un banco en el que quierp estar, debí de haber hecho una queja pero no tenía tiempo para hacerla, así que se salvó",Ya no buscaré qlgo más con ustedes
100,Segmento 2,MES 2,0,3,NO ENCONTRE RESPUESTA,DARME SOLUCION A MI PQR
101,Segmento 1,MES 3,0,3,"Não sou cliente.
Continuo a receber mail erradamente.",Alterem o mail do vosso cliente
102,Segmento 2,MES 1,2,1,"La atención no es la mejor, y ponen muchas trabas para los formatos que deberían suministrar más facilmente los cajeros o las personas de servicio al cliente.","Que cuando se solicitar los formularios, abonos cuentas AFC, Retiros para abono a capital cuenta AFC, fuera más fácil acceso, así como la actualización de la páguina web"
103,Segmento 1,MES 2,0,1,No atienden bien,
104,Segmento 2,MES 3,0,3,"Porque tuve tantos problemas de intento de fraudes específicamente con sus tarjetas que ir a las oficinas, en nada cambia mi sensación de inseguridad en torno a los productos.",Revisen qué pasa con la información que uno les entrega porque los intentos de fraude requerían información que solo tenían ustedes y yo.
105,Segmento 1,MES 1,0,4,"Por qué hicieron actualizar un celular al cual me llaman a diario , por quede sin lograr los estratos que son imposible bajarlos por la app o el PC . No es posible que para registrar u obtener nombre de usuario desde ayer estoy esperando el email, y eso que tampoco tengo password. No entiendo por qué los estratos no los siguen enviand virtual como lo hacen los bancos",Enviar los extractos por  e mail
106,Segmento 1,MES 2,0,5,No me llegó el extracto no lo encontré y me puse en mora y casi se juntan dos cuotas más los intereses de no pagar a tiempo,Mejorar el servicio de correspondencia de las fechas de pago..
107,Segmento 1,MES 3,5,3,solicite un cupo para abances no ácido posible tan poco tengo respuesta el motivo,dar respuesta clara y oportuna
108,Segmento 1,MES 1,1,1,"LLEVO CON LA EMPRESA, 6 AÑOS LLEVO PAGANDO 3 AÑOS SEGIDOS UN SEGURO EN LA CUENTA SE MUEVE UN PROMEDIO ENTRE8 MILLOS DE PESOS MENSUALES
Y NO ME PRESTARON 5 MILLONES PARA HACER VIDA CREDITICIA Y NI UNA TARJETA DE CREDITO ME OFRECIERON, CON ESO ENTIENDO Q ALOS CLIENTES NO SON TENIDO EN CUENTA. POR ESO NO LA PUEDO RECOMENDAR",LO MINIMO ES DARLE PRIORIDAD A LOS CLIENTES ANTIGUOS Y MINIMO ALGUIEN Q LLEVE MAS DE 3 AÑOS CON SUS PRODUCTOS.
109,Segmento 1,MES 2,3,2,Muy mala atención mucha demora para un cumple reclamo.,Ponerles más atención a esas personas que hacen que trabajan y apenas miran los clientes.
110,Segmento 1,MES 3,3,3,No lo recomiendo es un banco muy costoso en los servicios prestados,
111,Segmento 2,MES 1,3,3,"Porque cuando hay algún retraso , no dan la información del incremento oportunamente y liquidan mal, paga uno lo que liquidan y luego sigue debiendo saluditos y luego vienen cobros por cobranzas que no son justificados",Que cuando se pida una liquidación. Lo hagan oportunamente y así le eviten al cuentabiente costos de cobranzas
112,Segmento 1,MES 2,1,1,"la atención al cliente, es de mala calidad. si quieren atender atienden, si necesitan pasar a alguien sin hacer fila lo hacen por encima del que tiene el turno, casi que es rogar para ser atendido","ponerse la mano en el corazón y sentir que nosotros como clientes estamos depositando nuestra confianza y nuestro dinero en sus manos, o sea somos los que ustedes necesitan, ojala hubiera una rebelión y todos sacaran su poco dinero de los bancos y así las corporaciones bancarias tendrían que ofrecer servicios dignos"
113,Segmento 1,MES 3,0,1,"No envian extractos  a pesar que los solicite que me lo enviaran a este que es mi correo, pero extrañamente si me envian información  del valor  de la cuota a pagar, no es posible  que deba pagar la cuota sin conocer mis extractos.",Solo por favor envienme mi extracto  mensual.  Gracias por su gestión
114,Segmento 1,MES 1,3,1,"Estuve 2 horas solicitado un 
cheque de un cdt  metieron que otra persona debía autorizar lo yo ya había hablado temprano con wsa señora y le había dicho que lo iba a retirar. Y después dicha mujer tiene el descaro delllamarme y no autorizado sino hacerme preguntas de datos wrdnalws cuando yi haba dejado ya mis huellas y cédula y había estado en la oficina  y luego se va la que me estaba ateniéndo y la que me llama no es capaz de enviar el correo a la oficia y si me cuelga. Mi dinero lo manejo yo no una asesora ordena si lo puedo sacar o no .",Agilizar 3l trámite no cerrar oficinas yenos ña que yo usaba avisar que uno depende de unnx para autores sacr wl diero de uno.. Cobtratar gente capacitada.  Idónea si ya me hicieron la biometria para que tengo que responder llamadas que pueden prestarse para fraudes.
115,Segmento 1,MES 2,1,3,Muy cara esa tarjeta de crédito; impagable!!’,La atención del asesor fue buena; me refiero a muy caros los intereses que ustedes manejan!! Es una tarjeta de crédito demasiado cara!!!
